{
  "id": "500123",
  "trace.id": "500123",
  "timestamp": 1718153645993,
  "attributes": {
    "name": "example-resource-01",
    "parent.id": "500123",
    "duration.ms": 0.42,
    "service.name": "myService",
    "error": true,
    "db.statement": "example_string",
    "http.url": "https://portal.example.com/path/abc123",
    "http.method": "example_string",
    "http.statusCode": 200
  }
}